{"predictionId":"11111111-1111-4111-8111-111111111111","pillar":"Maintenance","site":"LU","assetId":"LU-BF1","heatId":null,"kind":"LiningFailureRisk","timeToFailureDays":28.0,"predictedAt":"2026-06-21T10:05:00Z","confidence":0.91,"evidence":[{"metric":"ThermocoupleTemp","value":1487.2,"weight":0.58,"note":"Sustained thermal rise near bosh sensors"},{"metric":"HeatFlux","value":12.3,"weight":0.42,"note":"Synthetic replay degradation pattern"}],"modelVersion":"fabric-mlflow:rul-lining:7","inputWindowRef":"onelake://silver/features/lining/LU-BF1/2026-06-21T10:00:00Z","origin":"Synthetic","status":"Raised"}
